2020,9,"G4","Allegiant Air","MDW","Chicago, IL: Chicago Midway International",22.00,2.00,2.00,0.00,0.00,0.00,0.00,2.00,0.00,256.00,256.00,0.00,0.00,0.00,0.00,
2020,9,"G4","Allegiant Air","MEM","Memphis, TN: Memphis International",47.00,3.00,1.00,0.50,1.04,0.00,0.46,1.00,0.00,127.00,34.00,39.00,18.00,0.00,36.00,
2020,9,"G4","Allegiant Air","MFE","Mission/McAllen/Edinburg, TX: McAllen Miller International",10.00,1.00,0.00,0.00,1.00,0.00,0.00,0.00,0.00,17.00,0.00,0.00,17.00,0.00,0.00,
2020,9,"G4","Allegiant Air","MFR","Medford, OR: Rogue Valley International - Medford",16.00,1.00,0.41,0.00,0.00,0.00,0.59,0.00,0.00,46.00,19.00,0.00,0.00,0.00,27.00,
2020,9,"G4","Allegiant Air","MLI","Moline, IL: Quad City International",9.00,0.00,0.00,0.00,0.00,0.00,0.00,0.00,0.00,0.00,0.00,0.00,0.00,0.00,0.00,
2020,9,"G4","Allegiant Air","MOT","Minot, ND: Minot International",16.00,4.00,2.09,0.00,1.87,0.00,0.04,0.00,0.00,109.00,60.00,0.00,48.00,0.00,1.00,
2020,9,"G4","Allegiant Air","MRY","Monterey, CA: Monterey Regional",10.00,0.00,0.00,0.00,0.00,0.00,0.00,0.00,0.00,0.00,0.00,0.00,0.00,0.00,0.00,
2020,9,"G4","Allegiant Air","MSO","Missoula, MT: Missoula International",16.00,2.00,0.32,0.00,0.11,0.00,1.56,0.00,0.00,85.00,14.00,0.00,5.00,0.00,66.00,
2020,9,"G4","Allegiant Air","MSY","New Orleans, LA: Louis Armstrong New Orleans International",8.00,0.00,0.00,0.00,0.00,0.00,0.00,0.00,0.00,0.00,0.00,0.00,0.00,0.00,0.00,
2020,9,"G4","Allegiant Air","MYR","Myrtle Beach, SC: Myrtle Beach International",30.00,5.00,1.95,1.00,0.05,0.00,2.00,0.00,0.00,238.00,129.00,44.00,3.00,0.00,62.00,
2020,9,"G4","Allegiant Air","OAK","Oakland, CA: Metropolitan Oakland International",28.00,4.00,2.00,1.00,1.00,0.00,0.00,2.00,0.00,142.00,84.00,20.00,38.00,0.00,0.00,
2020,9,"G4","Allegiant Air","OGD","Ogden, UT: Ogden-Hinckley",8.00,2.00,0.00,0.15,0.54,0.00,1.30,0.00,0.00,44.00,0.00,4.00,11.00,0.00,29.00,
2020,9,"G4","Allegiant Air","OKC","Oklahoma City, OK: Will Rogers World",16.00,4.00,3.76,0.00,0.24,0.00,0.00,0.00,0.00,132.00,128.00,0.00,4.00,0.00,0.00,
2020,9,"G4","Allegiant Air","OMA","Omaha, NE: Eppley Airfield",9.00,1.00,1.00,0.00,0.00,0.00,0.00,1.00,0.00,16.00,16.00,0.00,0.00,0.00,0.00,
2020,9,"G4","Allegiant Air","ORF","Norfolk, VA: Norfolk International",18.00,1.00,0.00,0.20,0.09,0.00,0.71,0.00,0.00,69.00,0.00,14.00,6.00,0.00,49.00,
2020,9,"G4","Allegiant Air","OWB","Owensboro, KY: Owensboro Daviess County Regional",5.00,0.00,0.00,0.00,0.00,0.00,0.00,0.00,0.00,0.00,0.00,0.00,0.00,0.00,0.00,
2020,9,"G4","Allegiant Air","PBG","Plattsburgh, NY: Plattsburgh International",11.00,0.00,0.00,0.00,0.00,0.00,0.00,2.00,0.00,0.00,0.00,0.00,0.00,0.00,0.00,
2020,9,"G4","Allegiant Air","PBI","West Palm Beach/Palm Beach, FL: Palm Beach International",23.00,3.00,1.17,0.00,0.31,0.00,1.52,3.00,0.00,97.00,33.00,0.00,5.00,0.00,59.00,
2020,9,"G4","Allegiant Air","PGD","Punta Gorda, FL: Punta Gorda Airport",234.00,36.00,11.99,3.09,5.47,0.00,15.45,1.00,0.00,2916.00,1329.00,165.00,206.00,0.00,1216.00,
2020,9,"G4","Allegiant Air","PIA","Peoria, IL: General Downing - Peoria International",46.00,3.00,1.91,0.00,0.60,0.00,0.49,2.00,0.00,82.00,51.00,0.00,14.00,0.00,17.00,
2020,9,"G4","Allegiant Air","PIE","St. Petersburg, FL: St Pete Clearwater International",360.00,45.00,12.53,3.65,10.42,1.16,17.25,3.00,0.00,3571.00,1687.00,261.00,608.00,39.00,976.00,
2020,9,"G4","Allegiant Air","PIT","Pittsburgh, PA: Pittsburgh International",76.00,11.00,5.82,0.00,0.98,0.00,4.20,1.00,0.00,697.00,422.00,0.00,36.00,0.00,239.00,
2020,9,"G4","Allegiant Air","PSC","Pasco/Kennewick/Richland, WA: Tri Cities",16.00,1.00,0.81,0.00,0.19,0.00,0.00,2.00,0.00,16.00,13.00,0.00,3.00,0.00,0.00,
2020,9,"G4","Allegiant Air","PSM","Portsmouth, NH: Portsmouth International at Pease",8.00,2.00,0.69,0.00,1.00,0.00,0.31,0.00,0.00,77.00,35.00,0.00,26.00,0.00,16.00,
2020,9,"G4","Allegiant Air","PSP","Palm Springs, CA: Palm Springs International",8.00,0.00,0.00,0.00,0.00,0.00,0.00,0.00,0.00,0.00,0.00,0.00,0.00,0.00,0.00,
2020,9,"G4","Allegiant Air","PVD","Providence, RI: Theodore Francis Green State",8.00,1.00,1.00,0.00,0.00,0.00,0.00,0.00,0.00,34.00,34.00,0.00,0.00,0.00,0.00,
2020,9,"G4","Allegiant Air","PVU","Provo, UT: Provo Municipal",46.00,4.00,2.03,1.00,0.13,0.00,0.84,0.00,0.00,85.00,48.00,15.00,3.00,0.00,19.00,
2020,9,"G4","Allegiant Air","RAP","Rapid City, SD: Rapid City Regional",16.00,1.00,1.00,0.00,0.00,0.00,0.00,0.00,0.00,18.00,18.00,0.00,0.00,0.00,0.00,
2020,9,"G4","Allegiant Air","RDM","Bend/Redmond, OR: Roberts Field",10.00,2.00,0.00,0.00,2.00,0.00,0.00,0.00,0.00,45.00,0.00,0.00,45.00,0.00,0.00,
2020,9,"G4","Allegiant Air","RFD","Rockford, IL: Chicago/Rockford International",45.00,3.00,1.39,0.00,0.94,0.00,0.67,3.00,0.00,82.00,53.00,0.00,17.00,0.00,12.00,
2020,9,"G4","Allegiant Air","RIC","Richmond, VA: Richmond International",16.00,1.00,0.00,0.00,0.00,0.00,1.00,0.00,0.00,29.00,0.00,0.00,0.00,0.00,29.00,
2020,9,"G4","Allegiant Air","RNO","Reno, NV: Reno/Tahoe International",16.00,3.00,1.00,0.00,1.00,0.00,1.00,0.00,0.00,113.00,60.00,0.00,22.00,0.00,31.00,
2020,9,"G4","Allegiant Air","ROA","Roanoke, VA: Roanoke Blacksburg Regional Woodrum Field",16.00,5.00,3.00,1.02,0.00,0.00,0.98,0.00,0.00,223.00,99.00,82.00,0.00,0.00,42.00,
2020,9,"G4","Allegiant Air","ROC","Rochester, NY: Greater Rochester International",2.00,0.00,0.00,0.00,0.00,0.00,0.00,0.00,0.00,0.00,0.00,0.00,0.00,0.00,0.00,
2020,9,"G4","Allegiant Air","SAN","San Diego, CA: San Diego International",2.00,0.00,0.00,0.00,0.00,0.00,0.00,0.00,0.00,0.00,0.00,0.00,0.00,0.00,0.00,
2020,9,"G4","Allegiant Air","SAV","Savannah, GA: Savannah/Hilton Head International",56.00,14.00,4.04,0.00,2.70,0.00,7.26,2.00,0.00,607.00,173.00,0.00,72.00,0.00,362.00,
2020,9,"G4","Allegiant Air","SBN","South Bend, IN: South Bend International",41.00,0.00,0.00,0.00,0.00,0.00,0.00,0.00,0.00,0.00,0.00,0.00,0.00,0.00,0.00,
2020,9,"G4","Allegiant Air","SCE","State College, PA: University Park",10.00,1.00,0.89,0.00,0.11,0.00,0.00,0.00,0.00,74.00,66.00,0.00,8.00,0.00,0.00,
2020,9,"G4","Allegiant Air","SCK","Stockton, CA: Stockton Metropolitan",28.00,2.00,1.00,0.00,0.20,0.00,0.80,0.00,0.00,64.00,24.00,0.00,8.00,0.00,32.00,
2020,9,"G4","Allegiant Air","SDF","Louisville, KY: Louisville Muhammad Ali International",40.00,2.00,0.94,1.00,0.06,0.00,0.00,0.00,0.00,101.00,63.00,34.00,4.00,0.00,0.00,
2020,9,"G4","Allegiant Air","SFB","Sanford, FL: Orlando Sanford International",364.00,59.00,21.08,4.69,5.86,0.29,27.08,0.00,1.00,4447.00,2373.00,298.00,247.00,8.00,1521.00,
2020,9,"G4","Allegiant Air","SGF","Springfield, MO: Springfield-Branson National",44.00,7.00,1.29,1.19,0.46,1.00,3.06,0.00,0.00,300.00,62.00,47.00,14.00,55.00,122.00,
2020,9,"G4","Allegiant Air","SHV","Shreveport, LA: Shreveport Regional",15.00,1.00,1.00,0.00,0.00,0.00,0.00,1.00,0.00,56.00,56.00,0.00,0.00,0.00,0.00,
2020,9,"G4","Allegiant Air","SMX","Santa Maria, CA: Santa Maria Public/Capt. G. Allan Hancock Field",9.00,0.00,0.00,0.00,0.00,0.00,0.00,1.00,0.00,0.00,0.00,0.00,0.00,0.00,0.00,
2020,9,"G4","Allegiant Air","SPI","Springfield, IL: Abraham Lincoln Capital",1.00,0.00,0.00,0.00,0.00,0.00,0.00,0.00,0.00,0.00,0.00,0.00,0.00,0.00,0.00,
2020,9,"G4","Allegiant Air","SRQ","Sarasota/Bradenton, FL: Sarasota/Bradenton International",98.00,8.00,3.00,0.11,0.02,0.00,4.88,4.00,1.00,1292.00,892.00,3.00,2.00,0.00,395.00,
2020,9,"G4","Allegiant Air","STC","St. Cloud, MN: St. Cloud Regional",5.00,1.00,0.00,0.00,1.00,0.00,0.00,0.00,0.00,25.00,0.00,0.00,25.00,0.00,0.00,
2020,9,"G4","Allegiant Air","SWF","Newburgh/Poughkeepsie, NY: New York Stewart International",14.00,1.00,0.00,0.00,0.00,0.11,0.89,0.00,0.00,61.00,0.00,0.00,0.00,7.00,54.00,
2020,9,"G4","Allegiant Air","SYR","Syracuse, NY: Syracuse Hancock International",18.00,3.00,1.96,0.00,0.04,0.00,1.00,2.00,0.00,100.00,77.00,0.00,1.00,0.00,22.00,
2020,9,"G4","Allegiant Air","TOL","Toledo, OH: Toledo Express",19.00,1.00,0.18,0.82,0.00,0.00,0.00,0.00,0.00,102.00,18.00,84.00,0.00,0.00,0.00,
2020,9,"G4","Allegiant Air","TRI","Bristol/Johnson City/Kingsport, TN: Tri Cities",8.00,0.00,0.00,0.00,0.00,0.00,0.00,0.00,0.00,0.00,0.00,0.00,0.00,0.00,0.00,
2020,9,"G4","Allegiant Air","TUL","Tulsa, OK: Tulsa International",18.00,0.00,0.00,0.00,0.00,0.00,0.00,0.00,0.00,0.00,0.00,0.00,0.00,0.00,0.00,
2020,9,"G4","Allegiant Air","TVC","Traverse City, MI: Cherry Capital",13.00,1.00,0.00,1.00,0.00,0.00,0.00,0.00,0.00,16.00,0.00,16.00,0.00,0.00,0.00,
2020,9,"G4","Allegiant Air","TYS","Knoxville, TN: McGhee Tyson",96.00,27.00,3.89,4.94,11.79,0.00,6.38,2.00,1.00,3255.00,304.00,587.00,1881.00,0.00,483.00,
2020,9,"G4","Allegiant Air","USA","Concord, NC: Concord Padgett Regional",56.00,9.00,4.05,1.00,2.70,0.00,1.25,0.00,0.00,460.00,224.00,34.00,114.00,0.00,88.00,
2020,9,"G4","Allegiant Air","VPS","Valparaiso, FL: Eglin AFB Destin Fort Walton Beach",177.00,22.00,4.47,3.10,2.99,0.00,11.45,2.00,0.00,2476.00,337.00,1308.00,112.00,0.00,719.00,
2020,9,"G4","Allegiant Air","XNA","Fayetteville, AR: Northwest Arkansas Regional",39.00,8.00,3.68,1.00,1.36,0.00,1.97,1.00,0.00,851.00,403.00,249.00,72.00,0.00,127.00,
2020,9,"HA","Hawaiian Airlines Inc.","HNL","Honolulu, HI: Daniel K Inouye International",756.00,25.00,19.01,0.00,0.00,0.00,5.99,2.00,1.00,1234.00,983.00,0.00,0.00,0.00,251.00,
2020,9,"HA","Hawaiian Airlines Inc.","ITO","Hilo, HI: Hilo International",142.00,5.00,5.00,0.00,0.00,0.00,0.00,0.00,0.00,168.00,168.00,0.00,0.00,0.00,0.00,
2020,9,"HA","Hawaiian Airlines Inc.","KOA","Kona, HI: Ellison Onizuka Kona International at Keahole",143.00,2.00,2.00,0.00,0.00,0.00,0.00,1.00,0.00,43.00,43.00,0.00,0.00,0.00,0.00,
2020,9,"HA","Hawaiian Airlines Inc.","LAX","Los Angeles, CA: Los Angeles International",32.00,10.00,10.00,0.00,0.00,0.00,0.00,0.00,0.00,349.00,349.00,0.00,0.00,0.00,0.00,
2020,9,"HA","Hawaiian Airlines Inc.","LIH","Lihue, HI: Lihue Airport",146.00,6.00,5.00,0.00,0.00,0.00,1.00,0.00,0.00,244.00,210.00,0.00,0.00,0.00,34.00,
2020,9,"HA","Hawaiian Airlines Inc.","OGG","Kahului, HI: Kahului Airport",168.00,1.00,1.00,0.00,0.00,0.00,0.00,0.00,0.00,77.00,77.00,0.00,0.00,0.00,0.00,
2020,9,"HA","Hawaiian Airlines Inc.","PDX","Portland, OR: Portland International",22.00,0.00,0.00,0.00,0.00,0.00,0.00,0.00,0.00,0.00,0.00,0.00,0.00,0.00,0.00,
2020,9,"HA","Hawaiian Airlines Inc.","SAN","San Diego, CA: San Diego International",30.00,6.00,6.00,0.00,0.00,0.00,0.00,0.00,0.00,193.00,193.00,0.00,0.00,0.00,0.00,
2020,9,"HA","Hawaiian Airlines Inc.","SEA","Seattle, WA: Seattle/Tacoma International",30.00,1.00,1.00,0.00,0.00,0.00,0.00,0.00,0.00,45.00,45.00,0.00,0.00,0.00,0.00,
2020,9,"HA","Hawaiian Airlines Inc.","SFO","San Francisco, CA: San Francisco International",30.00,2.00,2.00,0.00,0.00,0.00,0.00,0.00,0.00,115.00,115.00,0.00,0.00,0.00,0.00,
2020,9,"HA","Hawaiian Airlines Inc.","SMF","Sacramento, CA: Sacramento International",13.00,0.00,0.00,0.00,0.00,0.00,0.00,0.00,0.00,0.00,0.00,0.00,0.00,0.00,0.00,
2020,9,"MQ","Envoy Air","ABE","Allentown/Bethlehem/Easton, PA: Lehigh Valley International",30.00,5.00,1.49,0.00,3.51,0.00,0.00,0.00,0.00,112.00,37.00,0.00,75.00,0.00,0.00,
2020,9,"MQ","Envoy Air","ABI","Abilene, TX: Abilene Regional",116.00,11.00,4.60,1.78,2.35,0.00,2.26,0.00,0.00,811.00,311.00,175.00,115.00,0.00,210.00,
2020,9,"MQ","Envoy Air","ABQ","Albuquerque, NM: Albuquerque International Sunport",50.00,4.00,0.23,0.00,3.77,0.00,0.00,0.00,0.00,107.00,9.00,0.00,98.00,0.00,0.00,
2020,9,"MQ","Envoy Air","ACT","Waco, TX: Waco Regional",89.00,10.00,2.19,0.42,5.28,0.00,2.11,2.00,0.00,362.00,113.00,15.00,158.00,0.00,76.00,
2020,9,"MQ","Envoy Air","AEX","Alexandria, LA: Alexandria International",92.00,16.00,5.47,0.46,7.34,0.00,2.73,1.00,0.00,521.00,179.00,35.00,197.00,0.00,110.00,
2020,9,"MQ","Envoy Air","AGS","Augusta, GA: Augusta Regional at Bush Field",30.00,5.00,0.50,0.00,3.74,0.00,0.76,0.00,0.00,420.00,44.00,0.00,302.00,0.00,74.00,
2020,9,"MQ","Envoy Air","ALB","Albany, NY: Albany International",12.00,1.00,1.00,0.00,0.00,0.00,0.00,0.00,0.00,62.00,62.00,0.00,0.00,0.00,0.00,
2020,9,"MQ","Envoy Air","ALO","Waterloo, IA: Waterloo Regional",29.00,0.00,0.00,0.00,0.00,0.00,0.00,0.00,0.00,0.00,0.00,0.00,0.00,0.00,0.00,
2020,9,"MQ","Envoy Air","AMA","Amarillo, TX: Rick Husband Amarillo International",98.00,11.00,4.07,0.02,6.17,0.00,0.74,1.00,1.00,697.00,141.00,6.00,404.00,0.00,146.00,
2020,9,"MQ","Envoy Air","ATL","Atlanta, GA: Hartsfield-Jackson Atlanta International",9.00,0.00,0.00,0.00,0.00,0.00,0.00,0.00,0.00,0.00,0.00,0.00,0.00,0.00,0.00,
2020,9,"MQ","Envoy Air","ATW","Appleton, WI: Appleton International",72.00,1.00,1.00,0.00,0.00,0.00,0.00,0.00,0.00,21.00,21.00,0.00,0.00,0.00,0.00,
2020,9,"MQ","Envoy Air","AVP","Scranton/Wilkes-Barre, PA: Wilkes Barre Scranton International",32.00,0.00,0.00,0.00,0.00,0.00,0.00,0.00,0.00,0.00,0.00,0.00,0.00,0.00,0.00,
2020,9,"MQ","Envoy Air","AZO","Kalamazoo, MI: Kalamazoo/Battle Creek International",33.00,0.00,0.00,0.00,0.00,0.00,0.00,0.00,0.00,0.00,0.00,0.00,0.00,0.00,0.00,
2020,9,"MQ","Envoy Air","BFL","Bakersfield, CA: Meadows Field",8.00,4.00,0.00,1.01,0.55,0.00,2.45,0.00,0.00,267.00,0.00,50.00,43.00,0.00,174.00,
2020,9,"MQ","Envoy Air","BHM","Birmingham, AL: Birmingham-Shuttlesworth International",51.00,2.00,1.26,0.00,0.74,0.00,0.00,0.00,1.00,129.00,109.00,0.00,20.00,0.00,0.00,
2020,9,"MQ","Envoy Air","BIL","Billings, MT: Billings Logan International",60.00,6.00,0.35,0.79,4.00,0.00,0.86,1.00,0.00,198.00,9.00,63.00,90.00,0.00,36.00,
2020,9,"MQ","Envoy Air","BMI","Bloomington/Normal, IL: Central Il Regional Airport at Bloomington",22.00,3.00,1.35,0.00,1.65,0.00,0.00,0.00,0.00,83.00,47.00,0.00,36.00,0.00,0.00,
2020,9,"MQ","Envoy Air","BOI","Boise, ID: Boise Air Terminal",16.00,2.00,0.00,0.00,2.00,0.00,0.00,0.00,0.00,50.00,0.00,0.00,50.00,0.00,0.00,
2020,9,"MQ","Envoy Air","BPT","Beaumont/Port Arthur, TX: Jack Brooks Regional",52.00,1.00,0.62,0.00,0.38,0.00,0.00,0.00,0.00,34.00,21.00,0.00,13.00,0.00,0.00,
2020,9,"MQ","Envoy Air","BRO","Brownsville, TX: Brownsville South Padre Island International",52.00,3.00,0.00,1.00,2.00,0.00,0.00,0.00,0.00,127.00,0.00,92.00,35.00,0.00,0.00,
2020,9,"MQ","Envoy Air","BTR","Baton Rouge, LA: Baton Rouge Metropolitan/Ryan Field",71.00,11.00,1.63,1.89,4.97,0.00,2.50,0.00,0.00,610.00,43.00,242.00,126.00,0.00,199.00,
2020,9,"MQ","Envoy Air","BUF","Buffalo, NY: Buffalo Niagara International",72.00,0.00,0.00,0.00,0.00,0.00,0.00,0.00,0.00,0.00,0.00,0.00,0.00,0.00,0.00,
2020,9,"MQ","Envoy Air","BZN","Bozeman, MT: Bozeman Yellowstone International",1.00,0.00,0.00,0.00,0.00,0.00,0.00,0.00,0.00,0.00,0.00,0.00,0.00,0.00,0.00,
2020,9,"MQ","Envoy Air","CAE","Columbia, SC: Columbia Metropolitan",46.00,10.00,1.56,0.00,6.68,0.00,1.76,0.00,0.00,367.00,52.00,0.00,170.00,0.00,145.00,
2020,9,"MQ","Envoy Air","CHA","Chattanooga, TN: Lovell Field",68.00,3.00,0.00,0.01,1.32,0.00,1.67,0.00,0.00,328.00,0.00,3.00,35.00,0.00,290.00,
2020,9,"MQ","Envoy Air","CHO","Charlottesville, VA: Charlottesville Albemarle",51.00,3.00,0.00,0.52,2.48,0.00,0.00,0.00,0.00,104.00,0.00,26.00,78.00,0.00,0.00,
2020,9,"MQ","Envoy Air","CHS","Charleston, SC: Charleston AFB/International",79.00,10.00,2.11,0.00,7.89,0.00,0.00,0.00,1.00,270.00,79.00,0.00,191.00,0.00,0.00,
2020,9,"MQ","Envoy Air","CID","Cedar Rapids/Iowa City, IA: The Eastern Iowa",69.00,9.00,1.44,0.99,6.04,0.00,0.53,0.00,0.00,192.00,37.00,18.00,127.00,0.00,10.00,
2020,9,"MQ","Envoy Air","CLE","Cleveland, OH: Cleveland-Hopkins International",52.00,3.00,0.00,0.00,3.00,0.00,0.00,0.00,0.00,57.00,0.00,0.00,57.00,0.00,0.00,
2020,9,"MQ","Envoy Air","CLL","College Station/Bryan, TX: Easterwood Field",62.00,7.00,0.87,0.83,4.85,0.00,0.45,0.00,0.00,230.00,13.00,39.00,169.00,0.00,9.00,
2020,9,"MQ","Envoy Air","CLT","Charlotte, NC: Charlotte Douglas International",295.00,19.00,9.06,0.00,4.76,0.00,5.18,0.00,1.00,580.00,316.00,0.00,93.00,0.00,171.00,
2020,9,"MQ","Envoy Air","CMH","Columbus, OH: John Glenn Columbus International",195.00,10.00,1.00,0.92,6.52,0.00,1.56,0.00,1.00,298.00,86.00,21.00,139.00,0.00,52.00,
2020,9,"MQ","Envoy Air","CMI","Champaign/Urbana, IL: University of Illinois/Willard",31.00,3.00,1.00,1.09,0.00,0.00,0.91,0.00,0.00,222.00,22.00,90.00,0.00,0.00,110.00,
2020,9,"MQ","Envoy Air","COS","Colorado Springs, CO: City of Colorado Springs Municipal",28.00,0.00,0.00,0.00,0.00,0.00,0.00,0.00,0.00,0.00,0.00,0.00,0.00,0.00,0.00,
2020,9,"MQ","Envoy Air","COU","Columbia, MO: Columbia Regional",51.00,7.00,4.42,0.06,0.84,0.00,1.68,0.00,0.00,569.00,189.00,5.00,41.00,0.00,334.00,
2020,9,"MQ","Envoy Air","CRP","Corpus Christi, TX: Corpus Christi International",117.00,18.00,2.83,1.11,12.51,0.00,1.55,1.00,0.00,595.00,106.00,42.00,373.00,0.00,74.00,
2020,9,"MQ","Envoy Air","CVG","Cincinnati, OH: Cincinnati/Northern Kentucky International",191.00,13.00,2.83,1.79,3.17,0.00,5.21,1.00,0.00,791.00,106.00,91.00,121.00,0.00,473.00,
2020,9,"MQ","Envoy Air","CWA","Mosinee, WI: Central Wisconsin",45.00,6.00,2.30,0.00,3.02,0.00,0.68,0.00,0.00,302.00,123.00,0.00,166.00,0.00,13.00,
2020,9,"MQ","Envoy Air","DAY","Dayton, OH: James M Cox/Dayton International",56.00,1.00,1.00,0.00,0.00,0.00,0.00,0.00,0.00,81.00,81.00,0.00,0.00,0.00,0.00,
2020,9,"MQ","Envoy Air","DBQ","Dubuque, IA: Dubuque Regional",33.00,0.00,0.00,0.00,0.00,0.00,0.00,0.00,0.00,0.00,0.00,0.00,0.00,0.00,0.00,
2020,9,"MQ","Envoy Air","DFW","Dallas/Fort Worth, TX: Dallas/Fort Worth International",4685.00,786.00,113.38,58.04,454.86,2.64,157.08,54.00,19.00,46428.00,9482.00,7407.00,19048.00,121.00,10370.00,
2020,9,"MQ","Envoy Air","DRT","Del Rio, TX: Del Rio International",52.00,3.00,1.00,0.00,1.00,0.00,1.00,0.00,0.00,133.00,91.00,0.00,15.00,0.00,27.00,
2020,9,"MQ","Envoy Air","DSM","Des Moines, IA: Des Moines International",45.00,2.00,0.27,0.22,0.91,0.00,0.60,0.00,0.00,83.00,4.00,15.00,23.00,0.00,41.00,
2020,9,"MQ","Envoy Air","DTW","Detroit, MI: Detroit Metro Wayne County",6.00,0.00,0.00,0.00,0.00,0.00,0.00,0.00,0.00,0.00,0.00,0.00,0.00,0.00,0.00,
2020,9,"MQ","Envoy Air","ELP","El Paso, TX: El Paso International",59.00,7.00,1.65,0.00,5.35,0.00,0.00,0.00,0.00,237.00,95.00,0.00,142.00,0.00,0.00,
2020,9,"MQ","Envoy Air","EVV","Evansville, IN: Evansville Regional",60.00,7.00,5.55,0.00,0.18,0.00,1.28,1.00,0.00,321.00,199.00,0.00,3.00,0.00,119.00,
2020,9,"MQ","Envoy Air","EWR","Newark, NJ: Newark Liberty International",21.00,1.00,1.00,0.00,0.00,0.00,0.00,0.00,0.00,65.00,65.00,0.00,0.00,0.00,0.00,
2020,9,"MQ","Envoy Air","FAR","Fargo, ND: Hector International",49.00,1.00,1.00,0.00,0.00,0.00,0.00,0.00,0.00,30.00,30.00,0.00,0.00,0.00,0.00,
2020,9,"MQ","Envoy Air","FAY","Fayetteville, NC: Fayetteville Regional/Grannis Field",4.00,0.00,0.00,0.00,0.00,0.00,0.00,0.00,0.00,0.00,0.00,0.00,0.00,0.00,0.00,
2020,9,"MQ","Envoy Air","FNT","Flint, MI: Bishop International",42.00,1.00,0.00,0.00,1.00,0.00,0.00,0.00,0.00,28.00,0.00,0.00,28.00,0.00,0.00,
2020,9,"MQ","Envoy Air","FSD","Sioux Falls, SD: Joe Foss Field",64.00,3.00,1.00,0.00,2.00,0.00,0.00,0.00,0.00,145.00,102.00,0.00,43.00,0.00,0.00,
2020,9,"MQ","Envoy Air","FSM","Fort Smith, AR: Fort Smith Regional",38.00,6.00,0.48,0.03,2.92,0.00,2.57,0.00,0.00,317.00,12.00,5.00,57.00,0.00,243.00,
2020,9,"MQ","Envoy Air","FWA","Fort Wayne, IN: Fort Wayne International",17.00,1.00,0.00,0.35,0.45,0.00,0.19,0.00,0.00,31.00,0.00,11.00,14.00,0.00,6.00,
2020,9,"MQ","Envoy Air","GCK","Garden City, KS: Garden City Regional",60.00,3.00,1.00,1.00,0.42,0.00,0.58,1.00,0.00,248.00,38.00,73.00,57.00,0.00,80.00,
2020,9,"MQ","Envoy Air","GGG","Longview, TX: East Texas Regional",52.00,5.00,2.65,0.00,1.06,0.00,1.29,0.00,0.00,323.00,108.00,0.00,20.00,0.00,195.00,
2020,9,"MQ","Envoy Air","GJT","Grand Junction, CO: Grand Junction Regional",81.00,5.00,1.00,0.00,3.35,0.00,0.65,1.00,0.00,134.00,18.00,0.00,101.00,0.00,15.00,
2020,9,"MQ","Envoy Air","GNV","Gainesville, FL: Gainesville Regional",15.00,4.00,1.00,0.00,3.00,0.00,0.00,0.00,0.00,165.00,87.00,0.00,78.00,0.00,0.00,
2020,9,"MQ","Envoy Air","GRB","Green Bay, WI: Green Bay Austin Straubel International",65.00,6.00,3.48,0.00,2.52,0.00,0.00,0.00,0.00,221.00,146.00,0.00,75.00,0.00,0.00,
2020,9,"MQ","Envoy Air","GRI","Grand Island, NE: Central Nebraska Regional",56.00,6.00,2.03,0.00,1.93,0.00,2.03,0.00,0.00,158.00,41.00,0.00,40.00,0.00,77.00,
2020,9,"MQ","Envoy Air","GRK","Killeen, TX: Robert Gray AAF",140.00,27.00,10.36,3.04,9.23,0.00,4.36,1.00,2.00,1785.00,414.00,586.00,337.00,0.00,448.00,
2020,9,"MQ","Envoy Air","GRR","Grand Rapids, MI: Gerald R. Ford International",101.00,7.00,2.00,0.00,4.94,0.00,0.06,0.00,0.00,161.00,67.00,0.00,93.00,0.00,1.00,
2020,9,"MQ","Envoy Air","GSO","Greensboro/High Point, NC: Piedmont Triad International",122.00,11.00,3.27,0.35,5.15,0.00,2.23,1.00,0.00,375.00,140.00,7.00,109.00,0.00,119.00,
2020,9,"MQ","Envoy Air","GSP","Greer, SC: Greenville-Spartanburg International",97.00,8.00,2.50,0.00,5.50,0.00,0.00,0.00,0.00,188.00,74.00,0.00,114.00,0.00,0.00,
2020,9,"MQ","Envoy Air","HHH","Hilton Head, SC: Hilton Head Airport",6.00,0.00,0.00,0.00,0.00,0.00,0.00,0.00,0.00,0.00,0.00,0.00,0.00,0.00,0.00,
2020,9,"MQ","Envoy Air","HOU","Houston, TX: William P Hobby",64.00,9.00,1.44,0.00,7.42,0.00,0.13,0.00,0.00,344.00,63.00,0.00,279.00,0.00,2.00,
2020,9,"MQ","Envoy Air","HRL","Harlingen/San Benito, TX: Valley International",8.00,1.00,1.00,0.00,0.00,0.00,0.00,0.00,0.00,56.00,56.00,0.00,0.00,0.00,0.00,
2020,9,"MQ","Envoy Air","HSV","Huntsville, AL: Huntsville International-Carl T Jones Field",63.00,7.00,1.41,0.28,3.65,0.00,1.66,1.00,0.00,331.00,34.00,45.00,155.00,0.00,97.00,
2020,9,"MQ","Envoy Air","IAH","Houston, TX: George Bush Intercontinental/Houston",33.00,6.00,0.36,0.75,4.05,0.00,0.83,0.00,0.00,274.00,16.00,46.00,170.00,0.00,42.00,
2020,9,"MQ","Envoy Air","ICT","Wichita, KS: Wichita Dwight D Eisenhower National",86.00,8.00,2.10,1.09,4.69,0.00,0.13,0.00,0.00,283.00,43.00,77.00,154.00,0.00,9.00,
2020,9,"MQ","Envoy Air","ILM","Wilmington, NC: Wilmington International",60.00,10.00,2.17,0.06,6.22,0.00,1.55,0.00,0.00,577.00,63.00,9.00,239.00,0.00,266.00,
2020,9,"MQ","Envoy Air","IND","Indianapolis, IN: Indianapolis International",5.00,0.00,0.00,0.00,0.00,0.00,0.00,0.00,0.00,0.00,0.00,0.00,0.00,0.00,0.00,
2020,9,"MQ","Envoy Air","IPT","Williamsport, PA: Williamsport Regional",38.00,3.00,1.00,0.00,1.94,0.00,0.06,0.00,0.00,941.00,909.00,0.00,31.00,0.00,1.00,
2020,9,"MQ","Envoy Air","JAN","Jackson/Vicksburg, MS: Jackson Medgar Wiley Evers International",83.00,6.00,1.00,1.01,2.35,0.00,1.64,1.00,0.00,251.00,61.00,49.00,87.00,0.00,54.00,
2020,9,"MQ","Envoy Air","JAX","Jacksonville, FL: Jacksonville International",1.00,0.00,0.00,0.00,0.00,0.00,0.00,0.00,0.00,0.00,0.00,0.00,0.00,0.00,0.00,
2020,9,"MQ","Envoy Air","LAN","Lansing, MI: Capital Region International",52.00,0.00,0.00,0.00,0.00,0.00,0.00,0.00,0.00,0.00,0.00,0.00,0.00,0.00,0.00,
2020,9,"MQ","Envoy Air","LAW","Lawton/Fort Sill, OK: Lawton-Fort Sill Regional",14.00,2.00,0.00,0.91,0.82,0.00,0.27,1.00,0.00,118.00,0.00,94.00,20.00,0.00,4.00,
2020,9,"MQ","Envoy Air","LBB","Lubbock, TX: Lubbock Preston Smith International",60.00,4.00,2.31,0.00,0.85,0.00,0.84,0.00,0.00,117.00,48.00,0.00,22.00,0.00,47.00,
2020,9,"MQ","Envoy Air","LCH","Lake Charles, LA: Lake Charles Regional",69.00,6.00,3.11,1.00,1.89,0.00,0.00,16.00,0.00,204.00,107.00,55.00,42.00,0.00,0.00,
2020,9,"MQ","Envoy Air","LEX","Lexington, KY: Blue Grass",106.00,13.00,1.86,0.00,9.71,0.00,1.43,0.00,0.00,398.00,92.00,0.00,220.00,0.00,86.00,
2020,9,"MQ","Envoy Air","LFT","Lafayette, LA: Lafayette Regional Paul Fournet Field",45.00,4.00,0.33,0.45,3.21,0.00,0.00,0.00,0.00,265.00,12.00,74.00,179.00,0.00,0.00,
2020,9,"MQ","Envoy Air","LIT","Little Rock, AR: Bill and Hillary Clinton Nat Adams Field",143.00,16.00,4.15,3.10,6.39,0.00,2.36,0.00,0.00,1001.00,152.00,289.00,256.00,0.00,304.00,
2020,9,"MQ","Envoy Air","LRD","Laredo, TX: Laredo International",59.00,5.00,1.47,0.00,3.53,0.00,0.00,1.00,0.00,180.00,101.00,0.00,79.00,0.00,0.00,
2020,9,"MQ","Envoy Air","LSE","La Crosse, WI: La Crosse Regional",68.00,1.00,0.00,0.40,0.37,0.00,0.23,0.00,0.00,30.00,0.00,12.00,11.00,0.00,7.00,
2020,9,"MQ","Envoy Air","MAF","Midland/Odessa, TX: Midland International Air and Space Port",25.00,1.00,0.00,0.00,1.00,0.00,0.00,0.00,0.00,16.00,0.00,0.00,16.00,0.00,0.00,
2020,9,"MQ","Envoy Air","MCI","Kansas City, MO: Kansas City International",144.00,12.00,3.64,0.77,3.78,0.00,3.82,0.00,0.00,592.00,185.00,50.00,90.00,0.00,267.00,
2020,9,"MQ","Envoy Air","MDT","Harrisburg, PA: Harrisburg International",83.00,7.00,0.00,0.08,6.13,0.00,0.80,0.00,0.00,233.00,0.00,10.00,122.00,0.00,101.00,
2020,9,"MQ","Envoy Air","MEM","Memphis, TN: Memphis International",54.00,3.00,0.00,0.71,1.29,0.00,1.00,0.00,0.00,66.00,0.00,19.00,31.00,0.00,16.00,
2020,9,"MQ","Envoy Air","MFE","Mission/McAllen/Edinburg, TX: McAllen Miller International",86.00,17.00,4.46,0.02,10.88,0.00,1.64,1.00,0.00,608.00,126.00,1.00,352.00,0.00,129.00,
2020,9,"MQ","Envoy Air","MGM","Montgomery, AL: Montgomery Regional",38.00,5.00,1.00,0.47,0.99,0.00,2.54,0.00,0.00,425.00,29.00,91.00,85.00,0.00,220.00,
2020,9,"MQ","Envoy Air","MHK","Manhattan/Ft. Riley, KS: Manhattan Regional",55.00,2.00,0.00,0.00,1.11,0.00,0.89,0.00,0.00,40.00,0.00,0.00,23.00,0.00,17.00,
2020,9,"MQ","Envoy Air","MIA","Miami, FL: Miami International",183.00,13.00,6.61,0.00,6.39,0.00,0.00,0.00,0.00,414.00,247.00,0.00,167.00,0.00,0.00,
2020,9,"MQ","Envoy Air","MLI","Moline, IL: Quad City International",72.00,6.00,1.71,0.49,3.80,0.00,0.00,0.00,0.00,186.00,60.00,29.00,97.00,0.00,0.00,
2020,9,"MQ","Envoy Air","MLU","Monroe, LA: Monroe Regional",59.00,10.00,3.53,0.61,2.63,0.00,3.22,0.00,0.00,635.00,188.00,128.00,57.00,0.00,262.00,
2020,9,"MQ","Envoy Air","MOB","Mobile, AL: Mobile Regional",50.00,6.00,1.14,0.00,2.67,0.00,2.19,5.00,1.00,298.00,127.00,0.00,71.00,0.00,100.00,
2020,9,"MQ","Envoy Air","MQT","Marquette, MI: Sawyer International",33.00,3.00,1.67,0.00,0.33,0.00,1.00,0.00,0.00,56.00,33.00,0.00,5.00,0.00,18.00,
2020,9,"MQ","Envoy Air","MRY","Monterey, CA: Monterey Regional",30.00,2.00,0.00,0.00,2.00,0.00,0.00,0.00,0.00,58.00,0.00,0.00,58.00,0.00,0.00,
